venueName, featured, venueAddress,venueDescription,phoneNumber,email,capacityStanding,capacitySitting,venueSize,venueType,eventType,functionType,budgetPerHead
"BrickLane", true, "Admiralty","BRICKLANE (Admiralty), with its spacious and versatile layout complete with a huge terrace that oversees the Victoria Harbour, offers scenic alfresco dining experience to compliment every occasion. Apart from being one of the best places to view festive fireworks display in Hong Kong, it is an ideal location for weddings, private parties, corporate functions, fashion shows, business seminars and more.", "+852 65684848", "maxhsu1@gmail.com",300,400,"1000 square ft","Restaurant","Annual Dinner, Business Meeting","corporate-events", 400
"DraftLands", true, "Central, hollywood road","Great bar", "+852 1234567","maxhsu1@gmail.com",300,400,"1000 square feet", "bar","Annual-dinner, Networking Event","corporate-events, wedding",100
"Volar", true, "Central lkf 29 road","Best night club in town","+843 31234532","venueeventshk@gmail.com",500,200,"230 square feet","club","featured, Annual-dinner, Exhibition","corporate-events, party",300
"WeWork", true, "Central Lyndhusrt 00 road","Really good place to work and have an event space","+843 31234532","venueeventshk@gmail.com",500,200,"230 square feet","club","featured, Annual-dinner, Exhibition, breakfast-meeting","corporate-events, party",100
"Rula Live", false, "Central LKF 00 road","LIVE MUSIC","+843 31234532","venueeventshk@gmail.com",500,200,"230 square feet","club","featured, Annual-dinner, Exhibition, breakfast-meeting","corporate-events, party",300